{
  "schemaVersion": 1,
  "profileId": "hrtf-woodworth-reference",
  "name": "HRTF Woodworth Reference 7.1",
  "description": "Perfil espacial puramente analítico basado en el modelo de difracción esférica de Woodworth con corrección de sombra de cabeza (head-shadow ILD).",
  "game": {
    "id": "universal-spatial",
    "name": "Universal Spatial Audio",
    "supportedVersion": "All",
    "tacticalMode": "Zero-Latency Analytical HRTF"
  },
  "headphone": {
    "manufacturer": "Generic",
    "model": "Headphones",
    "variant": "Stereo",
    "calibrationStatus": "verified",
    "targetCurve": "Diffuse Field",
    "measurementSource": "Woodworth-Schlosser Analytical Diffraction Model",
    "measurementDate": "2026-10-30"
  },
  "audio": {
    "sampleRate": 48000,
    "channelLayout": "7.1",
    "preampDb": -6.0
  },
  "processing": {
    "headroomDb": -6.0,
    "bypassAll": false,
    "dynamics": {
      "targetLufs": -18.0,
      "ratio": 2.0,
      "attackMs": 20.0,
      "releaseMs": 150.0,
      "upwardAmount": 0.4,
      "downwardAmount": 0.3,
      "bypass": false
    },
    "transient": {
      "centerReductionDb": 2.5,
      "crossoverFrequencyHz": 280.0,
      "attackMs": 2.0,
      "releaseMs": 60.0,
      "bypass": false
    },
    "ambience": {
      "reductionDb": 3.0,
      "lowCutoffHz": 350.0,
      "highCutoffHz": 2500.0,
      "bypass": false
    },
    "equalizer": {
      "footstepsDb": 1.2,
      "bassDb": 1.0,
      "preampDb": 0.0,
      "bypass": false
    },
    "parametricEq": {
      "enabled": false,
      "bands": []
    },
    "limiter": {
      "ceilingDb": -0.5,
      "releaseMs": 60.0,
      "bypass": false
    }
  },
  "spatial": {
    "enabled": true,
    "soundstageWidth": 1.1,
    "apparentDistanceM": 1.4,
    "frontBackSeparation": 1.2,
    "elevationEmphasis": 0.5,
    "bypass": false
  },
  "metadata": {
    "author": "DashAudio Spatial Team",
    "license": "CC-BY-4.0",
    "version": "1.0.0",
    "createdAt": "2026-10-30",
    "changelog": "Dataset analítico sintetizado internamente con cero latencia y respuesta transitoria limpia.",
    "verified": true,
    "tags": ["spatial", "hrtf", "woodworth", "zero-latency", "7.1"]
  }
}
