{
  "schemaVersion": 1,
  "profileId": "warzone-competitive-default",
  "name": "Warzone Competitive Default",
  "description": "Perfil de torneo para Warzone. Maximiza la claridad de pisadas y recargas mientras atenúa agresivamente el estruendo de disparos y ambiente.",
  "game": {
    "id": "call-of-duty-warzone",
    "name": "Call of Duty: Warzone",
    "supportedVersion": "MW3 / Warzone 2.0+",
    "tacticalMode": "Competitive Footsteps Focus"
  },
  "headphone": {
    "manufacturer": "Generic",
    "model": "Tactical Headset",
    "variant": "Universal Stereo / 7.1",
    "calibrationStatus": "community",
    "targetCurve": "Harman Over-Ear 2018",
    "measurementSource": "DashAudio Competitive Lab",
    "measurementDate": "2026-10-30"
  },
  "audio": {
    "sampleRate": 48000,
    "channelLayout": "7.1",
    "preampDb": -6.0
  },
  "processing": {
    "headroomDb": -6.0,
    "bypassAll": false,
    "dynamics": {
      "targetLufs": -16.0,
      "ratio": 2.8,
      "attackMs": 15.0,
      "releaseMs": 120.0,
      "upwardAmount": 0.65,
      "downwardAmount": 0.45,
      "bypass": false
    },
    "transient": {
      "centerReductionDb": 4.5,
      "crossoverFrequencyHz": 280.0,
      "attackMs": 1.5,
      "releaseMs": 65.0,
      "bypass": false
    },
    "ambience": {
      "reductionDb": 6.5,
      "lowCutoffHz": 350.0,
      "highCutoffHz": 2500.0,
      "bypass": false
    },
    "equalizer": {
      "footstepsDb": 2.4,
      "bassDb": 0.8,
      "preampDb": 0.0,
      "bypass": false
    },
    "parametricEq": {
      "enabled": true,
      "bands": [
        {
          "index": 0,
          "type": "peaking",
          "frequencyHz": 3150.0,
          "gainDb": 2.2,
          "q": 1.4,
          "enabled": true
        },
        {
          "index": 1,
          "type": "peaking",
          "frequencyHz": 6300.0,
          "gainDb": 1.8,
          "q": 1.2,
          "enabled": true
        },
        {
          "index": 2,
          "type": "peaking",
          "frequencyHz": 120.0,
          "gainDb": -1.5,
          "q": 1.0,
          "enabled": true
        }
      ]
    },
    "limiter": {
      "ceilingDb": -0.5,
      "releaseMs": 50.0,
      "bypass": false
    }
  },
  "spatial": {
    "enabled": true,
    "soundstageWidth": 1.15,
    "apparentDistanceM": 1.3,
    "frontBackSeparation": 1.25,
    "elevationEmphasis": 1.0,
    "bypass": false
  },
  "metadata": {
    "author": "DashAudio Engineering",
    "license": "CC-BY-4.0",
    "version": "1.0.0",
    "createdAt": "2026-10-30",
    "changelog": "Versión inicial optimizada para torneos de Warzone",
    "verified": true,
    "tags": ["warzone", "competitive", "footsteps", "anti-gun-crack"]
  }
}
