{
  "schemaVersion": 1,
  "profileId": "razer-blackshark-v2-x",
  "name": "Razer BlackShark V2 X (Referencia Sin Calibrar)",
  "description": "Perfil base de compatibilidad para auriculares Razer BlackShark V2 X. Curva de compensación pendiente de medición acústica verificada (Gras 43AG / BK 5128).",
  "game": {
    "id": "universal-tactical",
    "name": "Universal Tactical Audio",
    "supportedVersion": "All",
    "tacticalMode": "Competitive Baseline"
  },
  "headphone": {
    "manufacturer": "Razer",
    "model": "BlackShark V2 X",
    "variant": "Standard 3.5mm Analog",
    "calibrationStatus": "uncalibrated_pending_verified_measurement",
    "targetCurve": "Harman Over-Ear 2018",
    "measurementSource": "PENDING_VERIFIED_MEASUREMENT",
    "measurementDate": ""
  },
  "audio": {
    "sampleRate": 48000,
    "channelLayout": "7.1",
    "preampDb": -6.0
  },
  "processing": {
    "headroomDb": -6.0,
    "bypassAll": false,
    "dynamics": {
      "targetLufs": -16.0,
      "ratio": 2.5,
      "attackMs": 20.0,
      "releaseMs": 120.0,
      "upwardAmount": 0.5,
      "downwardAmount": 0.5,
      "bypass": false
    },
    "transient": {
      "centerReductionDb": 4.0,
      "crossoverFrequencyHz": 280.0,
      "attackMs": 1.5,
      "releaseMs": 60.0,
      "bypass": false
    },
    "ambience": {
      "reductionDb": 6.0,
      "lowCutoffHz": 350.0,
      "highCutoffHz": 2500.0,
      "bypass": false
    },
    "equalizer": {
      "footstepsDb": 1.6,
      "bassDb": 1.5,
      "preampDb": 0.0,
      "bypass": false
    },
    "parametricEq": {
      "enabled": false,
      "bands": []
    },
    "limiter": {
      "ceilingDb": -0.5,
      "releaseMs": 50.0,
      "bypass": false
    }
  },
  "spatial": {
    "enabled": true,
    "soundstageWidth": 1.1,
    "apparentDistanceM": 1.4,
    "frontBackSeparation": 1.1,
    "elevationEmphasis": 0.0,
    "bypass": false
  },
  "metadata": {
    "author": "DashAudio Engineering",
    "license": "CC-BY-4.0",
    "version": "1.0.0",
    "createdAt": "2026-10-30",
    "changelog": "Perfil creado como referencia de modelo. Curva de calibración acústica deshabilitada a la espera de medición oficial verificada de laboratorio.",
    "verified": false,
    "tags": ["razer", "blackshark-v2-x", "uncalibrated", "headphone-reference"]
  }
}
